{
  "schema_version": 1,
  "profile_id": "astraldeep-production-uky-0.4.0",
  "release_id": "windows-0.4.0",
  "client_version": "0.4.0",
  "distribution": "production",
  "local_only": false,
  "authority": "https://iam.ai.uky.edu/realms/Astral",
  "websocket_endpoint": "wss://sandbox.ai.uky.edu/ws",
  "client_id": "astral-desktop",
  "auth_mode": "keycloak_oidc_pkce",
  "override_policy": {
    "managed_profile_allowed": true,
    "command_line_profile_allowed": true,
    "persisted_profile_allowed": true,
    "configure_dialog_allowed": false,
    "development_defaults_allowed": false
  },
  "agent_connection": {
    "byo_host": {
      "disposition": "authenticated_ui_tunnel"
    },
    "legacy_tools": {
      "disposition": "disabled",
      "credential_source": "none"
    }
  }
}
